{
  "schema_version": "1.0",
  "incident_id": "fire-eaton-sim",
  "mode": "historical-reconstruction-what-if",
  "generated_at": "2026-07-26T00:00:00Z",
  "model": {
    "family": "xgboost-aft",
    "version": "pilot-v0.1",
    "teacher": "ELMFIRE",
    "assessment": "pilot-limited",
    "aft_distribution_scale": 0.8,
    "source_model_manifest": "data/processed/example/aft-training-manifest.json",
    "output_semantics": "elmfire-teacher-grid-arrival-surrogate-prototype"
  },
  "scenario": {
    "wind_speed_add_mph": 0,
    "wind_direction_add_degrees": 0,
    "m1_add_percentage_points": 0,
    "m10_add_percentage_points": 0,
    "m100_add_percentage_points": 0,
    "initialization_hour_after_ignition": 1,
    "display_hours_after_ignition": [1, 3, 6],
    "prediction_time_unit": "hours-after-observed-perimeter-initialization",
    "grid_cell_size_meters": 240
  },
  "hourly_steps": [
    {
      "hour_offset": 1,
      "lead_hours_after_initialization": 0,
      "reached_grid_cell_count": 20,
      "connected_grid_cell_count": 20,
      "discarded_disconnected_grid_cell_count": 0,
      "spread_polygon_geojson": {
        "type": "Feature",
        "properties": {
          "hour_offset": 1,
          "lead_hours_after_initialization": 0,
          "source": "xgboost-aft-elmfire-surrogate"
        },
        "geometry": {
          "type": "Polygon",
          "coordinates": [
            [
              [-118.104, 34.18],
              [-118.088, 34.18],
              [-118.088, 34.189],
              [-118.104, 34.189],
              [-118.104, 34.18]
            ]
          ]
        }
      }
    },
    {
      "hour_offset": 3,
      "lead_hours_after_initialization": 2,
      "reached_grid_cell_count": 48,
      "connected_grid_cell_count": 48,
      "discarded_disconnected_grid_cell_count": 0,
      "spread_polygon_geojson": {
        "type": "Feature",
        "properties": {
          "hour_offset": 3,
          "lead_hours_after_initialization": 2,
          "source": "xgboost-aft-elmfire-surrogate"
        },
        "geometry": {
          "type": "Polygon",
          "coordinates": [
            [
              [-118.106, 34.176],
              [-118.08, 34.176],
              [-118.08, 34.193],
              [-118.106, 34.193],
              [-118.106, 34.176]
            ]
          ]
        }
      }
    },
    {
      "hour_offset": 6,
      "lead_hours_after_initialization": 5,
      "reached_grid_cell_count": 62,
      "connected_grid_cell_count": 62,
      "discarded_disconnected_grid_cell_count": 0,
      "spread_polygon_geojson": {
        "type": "Feature",
        "properties": {
          "hour_offset": 6,
          "lead_hours_after_initialization": 5,
          "source": "xgboost-aft-elmfire-surrogate"
        },
        "geometry": {
          "type": "Polygon",
          "coordinates": [
            [
              [-118.106, 34.176],
              [-118.078, 34.176],
              [-118.078, 34.195],
              [-118.106, 34.195],
              [-118.106, 34.176]
            ]
          ]
        }
      }
    }
  ],
  "warnings": [
    "Example geometry is illustrative and is not a real model result."
  ]
}
